{
  "schema_version": "3.1.0-lean.1",
  "run_id": "LRUN-f739ca9ed8489e68",
  "stage": "validation",
  "split": "validation",
  "required_call_cap": 32,
  "conditional_adjudication_cap": 8,
  "maximum_calls": 40,
  "calls_used": 0,
  "status": "planned",
  "holdouts_opened": false,
  "created_at": "2026-07-22T06:17:16.198902Z",
  "updated_at": "2026-07-22T08:37:02.973561Z",
  "calls": [
    {
      "call_id": "LCALL-4d9cb65abad69b65",
      "call_kind": "required",
      "case_id": "IS-P03",
      "role": "role_a",
      "prompt_hash": "28056d089319a244b549e05144b1da7f35e9edf012c839f6f173915cea6247d1",
      "provider": "OpenAI",
      "model_id": "gpt-5.6-sol",
      "family_claim": "same_family",
      "settings": {
        "reasoning_effort": "high",
        "sampling_controls": "not_exposed"
      },
      "status": "planned",
      "attempts": 0,
      "output_path": null,
      "output_sha256": null,
      "schema_valid": null,
      "started_at": null,
      "completed_at": null
    },
    {
      "call_id": "LCALL-22ffe698a22777e5",
      "call_kind": "required",
      "case_id": "IS-P03",
      "role": "role_b",
      "prompt_hash": "6a1ff4c42775fc70c91b48d342781a45c9f32e97f6bd40aa6ee00ec17ea0b745",
      "provider": "OpenAI",
      "model_id": "gpt-5.6-terra",
      "family_claim": "same_family",
      "settings": {
        "reasoning_effort": "high",
        "sampling_controls": "not_exposed"
      },
      "status": "planned",
      "attempts": 0,
      "output_path": null,
      "output_sha256": null,
      "schema_valid": null,
      "started_at": null,
      "completed_at": null
    },
    {
      "call_id": "LCALL-beec33bc26efe990",
      "call_kind": "required",
      "case_id": "IS-P03",
      "role": "role_c",
      "prompt_hash": "2f95cadd326555dc88083dbbfca1175c63dbc17a398a85ba6aabb7d80be4eb70",
      "provider": "OpenAI",
      "model_id": "gpt-5.6-sol",
      "family_claim": "same_family",
      "settings": {
        "reasoning_effort": "high",
        "sampling_controls": "not_exposed"
      },
      "status": "planned",
      "attempts": 0,
      "output_path": null,
      "output_sha256": null,
      "schema_valid": null,
      "started_at": null,
      "completed_at": null
    },
    {
      "call_id": "LCALL-ff75c6a613b9dfb1",
      "call_kind": "required",
      "case_id": "IS-P03",
      "role": "contrast_judge",
      "prompt_hash": "5a25d8ba934806ac5e9835b61b8d03c213979e775242c3acc013b6d4c93dfc87",
      "provider": "OpenAI",
      "model_id": "gpt-5.6-terra",
      "family_claim": "same_family",
      "settings": {
        "reasoning_effort": "high",
        "sampling_controls": "not_exposed"
      },
      "status": "planned",
      "attempts": 0,
      "output_path": null,
      "output_sha256": null,
      "schema_valid": null,
      "started_at": null,
      "completed_at": null
    },
    {
      "call_id": "LCALL-e5acc99cddac2d4d",
      "call_kind": "required",
      "case_id": "IS-P04",
      "role": "role_a",
      "prompt_hash": "28056d089319a244b549e05144b1da7f35e9edf012c839f6f173915cea6247d1",
      "provider": "OpenAI",
      "model_id": "gpt-5.6-sol",
      "family_claim": "same_family",
      "settings": {
        "reasoning_effort": "high",
        "sampling_controls": "not_exposed"
      },
      "status": "planned",
      "attempts": 0,
      "output_path": null,
      "output_sha256": null,
      "schema_valid": null,
      "started_at": null,
      "completed_at": null
    },
    {
      "call_id": "LCALL-0a5baec574969a80",
      "call_kind": "required",
      "case_id": "IS-P04",
      "role": "role_b",
      "prompt_hash": "6a1ff4c42775fc70c91b48d342781a45c9f32e97f6bd40aa6ee00ec17ea0b745",
      "provider": "OpenAI",
      "model_id": "gpt-5.6-terra",
      "family_claim": "same_family",
      "settings": {
        "reasoning_effort": "high",
        "sampling_controls": "not_exposed"
      },
      "status": "planned",
      "attempts": 0,
      "output_path": null,
      "output_sha256": null,
      "schema_valid": null,
      "started_at": null,
      "completed_at": null
    },
    {
      "call_id": "LCALL-d6c518d158cd324a",
      "call_kind": "required",
      "case_id": "IS-P04",
      "role": "role_c",
      "prompt_hash": "2f95cadd326555dc88083dbbfca1175c63dbc17a398a85ba6aabb7d80be4eb70",
      "provider": "OpenAI",
      "model_id": "gpt-5.6-sol",
      "family_claim": "same_family",
      "settings": {
        "reasoning_effort": "high",
        "sampling_controls": "not_exposed"
      },
      "status": "planned",
      "attempts": 0,
      "output_path": null,
      "output_sha256": null,
      "schema_valid": null,
      "started_at": null,
      "completed_at": null
    },
    {
      "call_id": "LCALL-99976444918daa22",
      "call_kind": "required",
      "case_id": "IS-P04",
      "role": "contrast_judge",
      "prompt_hash": "5a25d8ba934806ac5e9835b61b8d03c213979e775242c3acc013b6d4c93dfc87",
      "provider": "OpenAI",
      "model_id": "gpt-5.6-terra",
      "family_claim": "same_family",
      "settings": {
        "reasoning_effort": "high",
        "sampling_controls": "not_exposed"
      },
      "status": "planned",
      "attempts": 0,
      "output_path": null,
      "output_sha256": null,
      "schema_valid": null,
      "started_at": null,
      "completed_at": null
    },
    {
      "call_id": "LCALL-a844670774e7cf41",
      "call_kind": "required",
      "case_id": "MGMT-P03",
      "role": "role_a",
      "prompt_hash": "28056d089319a244b549e05144b1da7f35e9edf012c839f6f173915cea6247d1",
      "provider": "OpenAI",
      "model_id": "gpt-5.6-sol",
      "family_claim": "same_family",
      "settings": {
        "reasoning_effort": "high",
        "sampling_controls": "not_exposed"
      },
      "status": "planned",
      "attempts": 0,
      "output_path": null,
      "output_sha256": null,
      "schema_valid": null,
      "started_at": null,
      "completed_at": null
    },
    {
      "call_id": "LCALL-df7129ef6b6da95e",
      "call_kind": "required",
      "case_id": "MGMT-P03",
      "role": "role_b",
      "prompt_hash": "6a1ff4c42775fc70c91b48d342781a45c9f32e97f6bd40aa6ee00ec17ea0b745",
      "provider": "OpenAI",
      "model_id": "gpt-5.6-terra",
      "family_claim": "same_family",
      "settings": {
        "reasoning_effort": "high",
        "sampling_controls": "not_exposed"
      },
      "status": "planned",
      "attempts": 0,
      "output_path": null,
      "output_sha256": null,
      "schema_valid": null,
      "started_at": null,
      "completed_at": null
    },
    {
      "call_id": "LCALL-390bfb709f56dac3",
      "call_kind": "required",
      "case_id": "MGMT-P03",
      "role": "role_c",
      "prompt_hash": "2f95cadd326555dc88083dbbfca1175c63dbc17a398a85ba6aabb7d80be4eb70",
      "provider": "OpenAI",
      "model_id": "gpt-5.6-sol",
      "family_claim": "same_family",
      "settings": {
        "reasoning_effort": "high",
        "sampling_controls": "not_exposed"
      },
      "status": "planned",
      "attempts": 0,
      "output_path": null,
      "output_sha256": null,
      "schema_valid": null,
      "started_at": null,
      "completed_at": null
    },
    {
      "call_id": "LCALL-78cc33ce9f94eeb8",
      "call_kind": "required",
      "case_id": "MGMT-P03",
      "role": "contrast_judge",
      "prompt_hash": "5a25d8ba934806ac5e9835b61b8d03c213979e775242c3acc013b6d4c93dfc87",
      "provider": "OpenAI",
      "model_id": "gpt-5.6-terra",
      "family_claim": "same_family",
      "settings": {
        "reasoning_effort": "high",
        "sampling_controls": "not_exposed"
      },
      "status": "planned",
      "attempts": 0,
      "output_path": null,
      "output_sha256": null,
      "schema_valid": null,
      "started_at": null,
      "completed_at": null
    },
    {
      "call_id": "LCALL-e8031250a9de4a27",
      "call_kind": "required",
      "case_id": "MGMT-P04",
      "role": "role_a",
      "prompt_hash": "28056d089319a244b549e05144b1da7f35e9edf012c839f6f173915cea6247d1",
      "provider": "OpenAI",
      "model_id": "gpt-5.6-sol",
      "family_claim": "same_family",
      "settings": {
        "reasoning_effort": "high",
        "sampling_controls": "not_exposed"
      },
      "status": "planned",
      "attempts": 0,
      "output_path": null,
      "output_sha256": null,
      "schema_valid": null,
      "started_at": null,
      "completed_at": null
    },
    {
      "call_id": "LCALL-f882d4a727b0bf6f",
      "call_kind": "required",
      "case_id": "MGMT-P04",
      "role": "role_b",
      "prompt_hash": "6a1ff4c42775fc70c91b48d342781a45c9f32e97f6bd40aa6ee00ec17ea0b745",
      "provider": "OpenAI",
      "model_id": "gpt-5.6-terra",
      "family_claim": "same_family",
      "settings": {
        "reasoning_effort": "high",
        "sampling_controls": "not_exposed"
      },
      "status": "planned",
      "attempts": 0,
      "output_path": null,
      "output_sha256": null,
      "schema_valid": null,
      "started_at": null,
      "completed_at": null
    },
    {
      "call_id": "LCALL-7f04bebfce161b5a",
      "call_kind": "required",
      "case_id": "MGMT-P04",
      "role": "role_c",
      "prompt_hash": "2f95cadd326555dc88083dbbfca1175c63dbc17a398a85ba6aabb7d80be4eb70",
      "provider": "OpenAI",
      "model_id": "gpt-5.6-sol",
      "family_claim": "same_family",
      "settings": {
        "reasoning_effort": "high",
        "sampling_controls": "not_exposed"
      },
      "status": "planned",
      "attempts": 0,
      "output_path": null,
      "output_sha256": null,
      "schema_valid": null,
      "started_at": null,
      "completed_at": null
    },
    {
      "call_id": "LCALL-0d55f3d3410fa4a7",
      "call_kind": "required",
      "case_id": "MGMT-P04",
      "role": "contrast_judge",
      "prompt_hash": "5a25d8ba934806ac5e9835b61b8d03c213979e775242c3acc013b6d4c93dfc87",
      "provider": "OpenAI",